{
  "id": "292500952",
  "date": "20200925",
  "patch": "10.19",
  "me": "Tryndamere",
  "vs": "Maokai",
  "lane": "top",
  "rank": "Gold IV",
  "replay_file": "replays/RU-292500952.rofl",
  "details": "https://matchhistory.ru.leagueoflegends.com/ru/#match-details/RU/292500952/202436939?tab=overview",
  "full_video": "https://youtu.be/L8iQBhVkG44",
  "promo_video": "https://youtu.be/0JOYZ2z3cR4"
}
