{
  "id": "293040833",
  "date": "20200927",
  "patch": "10.19",
  "me": "Tryndamere",
  "vs": "Darius",
  "lane": "top",
  "rank": "Gold IV",
  "replay_file": "replays/RU-293040833.rofl",
  "details": "https://matchhistory.ru.leagueoflegends.com/ru/#match-details/RU/293040833/202436939?tab=overview",
  "full_video": "https://youtu.be/lMIDCt6Ttgo",
  "promo_video": "https://youtu.be/0uuHaxHjTWY"
}
